{
  "$schema": "./schemas/profile-config.schema.json",
  "displayName": "Your Name",
  "identities": [
    {
      "provider": "github",
      "login": "your-github-login",
      "ignoreOrganizations": [],
      "ignoreRepositories": ["your-github-login/your-github-login"]
    }
  ],
  "publishTargets": [
    {
      "provider": "github",
      "repositoryFullName": "your-github-login/your-github-login",
      "branch": "main",
      "path": "README.md",
      "tokenEnv": "GITHUB_README_TOKEN"
    }
  ],
  "render": {
    "topLanguagesCount": 7,
    "topPublicProjectsCount": 6,
    "lastYearWindowDays": 365
  }
}
