{
  "displayName": "Example User",
  "identities": [
    {
      "provider": "github",
      "login": "octocat",
      "ignoreOrganizations": ["some-noisy-org"],
      "ignoreRepositories": ["octocat/octocat"]
    }
  ],
  "publishTargets": [
    {
      "provider": "github",
      "repositoryFullName": "octocat/octocat",
      "branch": "main",
      "path": "README.md",
      "tokenEnv": "GITHUB_README_TOKEN"
    }
  ],
  "render": {
    "topLanguagesCount": 7,
    "topPublicProjectsCount": 6,
    "lastYearWindowDays": 365
  }
}
