{
  "displayName": "Karan Balani",
  "identities": [
    {
      "provider": "github",
      "login": "balanikaran",
      "ignoreOrganizations": ["some-noisy-org"],
      "ignoreRepositories": [
        "balanikaran/ypb-public",
        "balanikaran/ypb-media",
        "balanikaran/balanikaran.github.io",
        "balanikaran/balanikaran"
      ]
    }
  ],
  "publishTargets": [
    {
      "provider": "github",
      "repositoryFullName": "balanikaran/balanikaran",
      "branch": "main",
      "path": "README.md",
      "tokenEnv": "GITHUB_README_TOKEN"
    }
  ],
  "render": {
    "topLanguagesCount": 7,
    "topPublicProjectsCount": 6,
    "lastYearWindowDays": 365
  }
}
